linkedin_url,job_title,company,location,posted_date,job_description
https://www.linkedin.com/jobs/view/3995142132/?eBP=BUDGET_EXHAUSTED_JOB&refId=e9obDaH3D0ykCNJHBhSwcA%3D%3D&trackingId=UG7RxTEwc1oDMuMnAqOMyw%3D%3D&trk=flagship3_search_srp_jobs,"Thermal Design Engineer, Electronic Systems",Tesla,"Palo Alto, CA",8 months ago,"About the job
What To Expect
Tesla is seeking a highly motivated Thermal Design Engineer for the Electronic Systems teams to help develop best in class cooling solutions from silicon to vehicles to datacenters.

The role involves design and validation of passive, active air-, and active-liquid cooling solutions for electronic systems, either for vehicle platforms or off-vehicle systems. The position requires working closely with cross-functional teams at different scales (silicon to system), as well as external suppliers. A deep understanding of the fundamentals of fluid flow and heat transfer and ability to breakdown complex engineering problems into simple pieces that can be tackled by fundamentals is a must.

Creative thinking, ability to solve complex and challenging problems, and ability to work independently are of paramount importance. This position involves working in a dynamic and fast-paced environment with tight timing and dynamic constraints.

What You'll Do

Design passive and active air and liquid-cooling solution for high power electronics - from silicon to vehicle to data centers
Flow balancing in complex flow networks
Develop analytical and computational models of hydraulic and thermal systems
Drive component selection (Chiller, CDU, Fan, Pump, Filter, TIM)
Optimize cooling solutions for all aspects of their performance and reliability
Define thermal policy and control algorithms and characterize system response at different scales
Drive validation and analyze data
Contribute to module- and system-level reliability


What You'll Bring

Degree in Thermal/Mechanical Engineering, or equivalent experience
Minimum 2 years of industrial experience with evidence of exceptional performance
Strong understanding of fundamentals of fluid mechanics, heat transfer, and thermodynamics
Proficiency in numerical simulation of heat and fluid flow
Define thermal policy and control algorithms and characterize system response at different scales
Experience in data centers is an asset
Knowledge of semiconductor packaging and package-level thermal/mechanical considerations is an asset


Benefits
Compensation and Benefits
Along with competitive pay, as a full-time Tesla employee, you are eligible for the following benefits at day 1 of hire:
 Aetna PPO and HSA plans > 2 medical plan options with $0 payroll deduction
 Family-building, fertility, adoption and surrogacy benefits
 Dental (including orthodontic coverage) and vision plans, both have options with a $0 paycheck contribution
 Company Paid (Health Savings Account) HSA Contribution when enrolled in the High Deductible Aetna medical plan with HSA
 Healthcare and Dependent Care Flexible Spending Accounts (FSA)
 401(k) with employer match, Employee Stock Purchase Plans, and other financial benefits
 Company paid Basic Life, AD&D, short-term and long-term disability insurance
 Employee Assistance Program
 Sick and Vacation time (Flex time for salary positions), and Paid Holidays
 Back-up childcare and parenting support resources
 Voluntary benefits to include: critical illness, hospital indemnity, accident insurance, theft & legal services, and pet insurance
 Weight Loss and Tobacco Cessation Programs
 Tesla Babies program
 Commuter benefits
 Employee discounts and perks program


Expected Compensation

$106,400 - $256,200/annual salary + cash and stock awards + benefits

Pay offered may vary depending on multiple individualized factors, including market location, job-related knowledge, skills, and experience. The total compensation package for this position may also include other elements dependent on the position offered. Details of participation in these benefit plans will be provided if an employee receives an offer of employment.

, Tesla
See less"
https://www.linkedin.com/jobs/view/4142859812/?eBP=CwEAAAGWDZa4lCnLW-VgGleLgsjGznJT5gwQexN-0ppzwSop0573GWSzBBkmEfklTXrOnD_3Hyk0bpnju_-MCrL3RtDAj5ogm8INXJ-CgNZ-0GTZkgBkouXxKewekkcbUyEjdRILW9mQ3slPkIUv3SGF5291wQaESDL5lt7Pcf78ItamWeMi2-uiOtwXyQTYWZ6PUQg0llbhLkW2hAReRc1Tc4NPjpCiF8RIhM7xo4PPMDhSSYms6BukdcEjKJiMoB8sLIgAkv54t6MEQ_OF_Sswy31EkHeO-OsQsZPXvuSnIpsE2ZkKzDzBvbGZz4MKc6Yqld0T0S0UUK9_9ZcXMxD3DjxIs3-AzSzeu_mN3nVf7nAFVc9C_QtEjx_LBWxfX7l6kuee7ZFP0eweoh6v9c1t_lcN26B87AlJjwo02wjjuKFQBxNxxRHpPnbpCc-d1waJ4NSqaeD_USbiE8TMEsiE8QOkqBwZHVI1kJqPvXtik7BdPNv978Z-8W4DXoKH6bZKKe-v28teRMM&refId=e9obDaH3D0ykCNJHBhSwcA%3D%3D&trackingId=cvj8%2FG%2FPCdBgQUROPxogIw%3D%3D&trk=flagship3_search_srp_jobs,"Summer 2025 - Design Engineer Intern, Analog Power Management (6535)",TSMC,"Austin, TX",2 weeks ago,"About the job
Overview Of Role

TSMC's Power Management design team is seeking an MSEE or PhD candidate with a background in Analog Circuit design with interest in Power Management Integrated Circuits and Systems. In this role, you will support the research and development of highly integrated voltage regulators in TSMC most advanced 3DIC packaging technology. As part of this R&D team, you will be using TSMC’s state of the art process CMOS technologies mixed with 3D package and integrated passive device technologies to power large High-Performance Computing and Artificial Intelligence SoC’s. Job responsibilities include transistor level design, power system modeling and analysis, as well as silicon measurement and characterization. The successful candidate will be self-motivated, willing to learn exciting new technologies and be able to work effectively within a talented group of individuals.

This position is located at TSMC’s Austin Design Center, Austin, TX. We are currently operating in a hybrid work schedule with 4 days onsite.

Projects vary depending on development cycles and individual interests. You will gain exposure to a variety of IC design engineering skills and tools during your internship.











As a trusted technology and capacity provider, TSMC is driven by the desire to be:



TSMC pioneered the pure-play foundry business model when it was founded in 1987 and has been the world’s leading dedicated semiconductor foundry ever since. The Company supports a thriving ecosystem of global customers and partners with the industry’s leading process technologies and a portfolio of design enablement solutions to unleash innovation for the global semiconductor industry. With global operations spanning Asia, Europe, and North America, TSMC serves as a committed corporate citizen around the world.

In North America, TSMC has a strong sales and service organization that works with customers by helping them achieve silicon success with cutting-edge technologies and manufacturing excellence. The Company has continued to accelerate its R&D investment and staffing in recent years and is expanding its manufacturing footprint to support customer innovation with 3D IC technologies and optimal manufacturing capacity.

For positions requiring access to technical data subject to export control regulations, including Export Administration Regulations, TSMC North America may have to obtain export licensing approval from the U.S. Government for certain individuals. All employment is contingent upon TSMC North America obtaining any export license or other approval that may be required by the U.S. Government.



TSMC Technology, Inc. is committed to employing a diverse workforce and provides Equal Employment Opportunity for all individuals regardless of race, color, religion, gender, age, national origin, marital status, sexual orientation, gender identity, status as a protected veteran, genetic information, or any other characteristic protected by applicable law.

TSMC is an equal opportunity employer prizing diversity and inclusion. We are committed to treating all employees and applicants for employment with respect and dignity. If you require reasonable accommodation due to a disability during the application or the recruiting process, please feel free to notify us at G_ACCOMMODATIONS@TSMC.COM . TSMC confirms to all applicants its commitment to meet TSMC’s obligations under applicable employment law. Reasonable accommodations will be determined on a case-by-case basis.



At the time of this posting, this role typically pays an hourly rate between $35.00 and $42.00 per hour. The range displayed reflects the minimum and maximum target for new hires. Actual pay may be more or less than the posted range. Factors that influence pay include the individual's skills, qualifications, education, experience and the position level and location.
See more"
https://www.linkedin.com/jobs/view/4153676937/?eBP=BUDGET_EXHAUSTED_JOB&refId=e9obDaH3D0ykCNJHBhSwcA%3D%3D&trackingId=FNJfK%2FtaJNgdfJbIdTWY%2Fg%3D%3D&trk=flagship3_search_srp_jobs,Design Engineer,Kino AI,N/A,N/A,"About the job
About Our Work

Kino AI is building tools and training models to organize video. We serve top movie and TV studios, and we make editing more productive and enjoyable.

We're a deeply technical team from MIT, SpaceX, AWS and Citadel Securities. We're backed by Y Combinator, AI Grant, and many others.

Kino currently has more demand than it can handle. We need more engineers, deeper integration within current firms, and added capabilities. We're very excited about this next phase!

What You'll Do

Our product retrieves video from a search engine and then renders a lot of it. Search results need to feel relevant and the data needs to render quickly.

To Contribute To This Product, You Will

Build new features that delight users and make them work faster
Implement robust Figma designs and craft Kino's visual identity
Expand our video playback and editing system
Create high performance and well-tested React components
Respond to customer support issues and actively work to improve their daily usage of Kino
Our clients are top brands and media properties, whose footage is deeply important to them. We have very privileged access, and we must use it with care!

Tech

React (Typescript) with Tailwind, TanStack, and and web-based video technology
Lightweight state management library
Traditional db + vector db syncing
Designs in Figma (we believe traditional design systems slow us down)

About You

You have strong experience in React and web development, such that typical performance issues rarely appear
You are fast at implementing designs and maintain quality at top speed. You communicate when things will be done and stick to those deadlines. If there's a slowdown, you'll let us know immediately.
You are obsessed with performance and craft insofar as it helps the customer
You have good intuition of what our unique customers actually care about (search quality, video playback, snappiness)
You are eager to tackle hard engineering problems: massive simultaneous video playback, maintaining customer data privacy, rendering massive lists of data
You are proactive - you anticipate problems before they arise, you know what questions you’ll be asked and have prepared responses before they’re asked, you predict what the company will need next and proactively outline what it is and the steps for how we’ll get there. You realize we are offering a service, not just a product, and you will work to proactively service our customers at every step.
Experience in video, graphics, and GPU intensive interfaces is a massive plus

Logistics

This is a full-time, in-person opportunity in San Francisco. We're big believers in in-person culture!
We are open to sponsoring International candidates (e.g STEM OPT, OPT, H1B, O1, E3)
$135,000 - $200,000 a year
0.75%-2% equity
Support for those moving to the Bay Area

What We Offer

Work alongside world class engineers

Make your mark; this is a very new product with heavy customer usage.

Impact on a product that will change the entertainment industry

Interact daily with some of the most important entertainment brands

Unlimited PTO
See less"
https://www.linkedin.com/jobs/view/4061362628/?eBP=CwEAAAGWDZa4lM3NlRlq0RfkeKj3dGKI_iry0s4OO0WyF-PkyGSzxV8V8jifLCrCVYaKim4__ZUgcto3JS6SbLiYUsmr8P42BnIVhU-2hcge_p97ujwja5_JQv4X8TgASzsFHsde6z07rukIi3WeZ_tqCEdrtCkVMGjwjd4igcz9KHJTqxAz5Yg9nfTZcziTT17RCHc1fIqhmgI1SNXyXO45DPhNRk-DwtuW2OK-k35pkzD9XiLy3EmaGa7hsvqz-x-uy_YQE-75BEZAfHiyqFB0SkwazFzRyfHuYRoKqo7iihCR4w7oZRTMPu8ID4XRVja0iz5pWJLfAC_s5ZANISGgo3ihh5d23YLf6p0BqAD6Yw4sXJ2-6RZyim5094gKb6h178XLKH9rMSokIU8R36aFAGdOqF8H-2qesBIX2s4tKiC2P-yUY0YeGq6acYjv3lCo2MUL_hVWb5ON5oUyQY8rlengM6qw0H-xM8zRpGMIMML8lT-9mW4Mm_dPme_AspEAogIavsjD&refId=e9obDaH3D0ykCNJHBhSwcA%3D%3D&trackingId=BlcZp4SBVZqHC6w0Og7IRw%3D%3D&trk=flagship3_search_srp_jobs,Design Engineer Intern,Cadence,N/A,N/A,"About the job
At Cadence, we hire and develop leaders and innovators who want to make an impact on the world of technology.

The Cadence Silicon Solutions Group (SSG) develops industry-leading Digital IP (Intellectual Property), from RISC-V processor cores to DSPs to Memory Controllers and IO solutions. Our configurable and extensible IP solutions are poised to meet the demands of next-generation applications such as intelligent IoT Devices and ML/AI edge inference. All leading semiconductor providers can be counted as Cadence customers.

The Cadence SSG Team is hiring students to join our R&D teams in San Jose or Austin. This is an amazing opportunity to work at a world leader in computational software, semiconductor design IP, and system verification hardware.  Our customers are the world’s most innovative companies, delivering extraordinary electronic products from chips to boards to complete systems for the most dynamic market applications, including hyperscale computing, 5G communications, automotive, mobile, aerospace, consumer, industrial, and healthcare.

We aim to make you an integral part of the team by providing training, mentorship, and encouragement of your creative talents. Our goal is to equip students with practical work experience. We understand that it is best to learn by doing. We will provide tasks that enable you to learn while making meaningful technical contributions.

Be part of this great SSG Team where your contributions can make a visible impact. Your work will be integral to our success and the advancement of our industry. 

Description

The student Intern will work with amazing talent on the team who are developing a wide range of advanced Digital IP’s spanning Neural IP, Network on Chip, CPU Cores & DSP, and Vision Cores. The intern will work with the Physical Design CAD team and R&D to adopt latest capabilities to optimize the PPA for next generation of IP’s.

The Intern will also get an opportunity to work on designing IP’s on multiple generation of foundry technologies to deliver the best-in-class PPA for each technology node.

Position Requirements

The student intern should have completed foundational coursework in Digital IC design, Computer Architecture and VLSI design. Exposure to VLSI design tools including Genus Synthesis, Innovus P&R and Tempus Static Timing Analysis flows is expected. The Intern needs to have proficiency in one or more programming languages including Tcl, Python, Perl & JavaScript.

MS or PhD level program enrollment
Background in RTL design including Verilog, synthesis, lint, formal.
Strong communication skills
Scripting language experience a plus

We’re doing work that matters. Help us solve what others can’t.
See less"
https://www.linkedin.com/jobs/view/4199995400/?eBP=CwEAAAGWDZa4lIWRVyoKf-qYTAhKcdInz3KsqfVzjpReQivzgGtUy8CYggUFat89Qu4svO_leGjuGe4WQf1MdoGDkP7AeH_Tn1UJzSPKnb1PRpSJC2kaP3IY603OGDmEociHmDxY8wUFI8pcfbdO6DKnUhomsxQEfvvheSvle3etXXBFIz7nUsPj1XqJSm4j-2HhE0YIKNvN0RzkL7_fm_XZa-Dk8jPq0qTO3DsEGVwA4pQdcknP7LsQSqwwL-o81WDTYlKegfyfnTcA-OqIMtNaWzShz5qWXU9bGpHgN08SoYGKb79gg8mj6IuDpQWNs21I50ogBIyyyjV2oMXRy9BmSoy_mJ-c5x_lYV1nHPr9ZCTAbLw-YHTviTo13LbiMbRdUBviQH8IaY8jGmtwyTVje7qZ0GiMbpqShvqbT6OvjCd61-9kJqe6sJ0Yb9-dAGP_WkCqs2QysxXxj1Evqq-DFIPY9RzViHACahThKuwmZoSl0evIgnPq2aKSCY36FqiBBLAdDfcmrDzM5A&refId=e9obDaH3D0ykCNJHBhSwcA%3D%3D&trackingId=S%2Fkvk820DsJPltf1XekP8A%3D%3D&trk=flagship3_search_srp_jobs,Mixed Signal Design Engineer - New College Grad 2025,NVIDIA,N/A,N/A,"About the job
NVIDIA has continuously reinvented itself over two decades. Our invention of the GPU in 1999 sparked the growth of the PC gaming market, redefined modern computer graphics, and revolutionized parallel computing. More recently, GPU deep learning ignited modern AI — the next era of computing. NVIDIA is a “learning machine” that constantly evolves by adapting to new opportunities that are hard to solve, that only we can tackle, and that matter to the world. This is our life’s work, to amplify human creativity and intelligence. Make the choice and join us today!

This is a dynamic team working with pioneering, unique technology. If you are someone that loves a challenge, come join this diverse team and help move the needle! We are looking for a senior engineer to be part of the mixed-signal design team building next generation NVLINK. This position offers the opportunity to have real impact in a dynamic, technology-focused company impacting product lines ranging from consumer graphics to self-driving cars and the growing field of artificial intelligence.

What You'll Be Doing

Develop and implement high speed electrical/optical interfaces and analog circuits. You will have hands on experience taking innovative integrated circuit designs at data rates of 25Gbps and higher from concept through silicon characterization.
Help by defining circuit requirements and complete design from schematic, layout, and verification to characterization.
Conduct schematic design of deep-submicron CMOS technologies using Spectre, Hspice or like.
Lead architecture, transistor design and verification using industry standard EDA tools such as Cadence virtuoso.
Optimize circuit to meet the specifications for system performance.
Work closely with layout engineers by providing detailed floorplan and guidance for matching and high-speed routings.
Provide support for post-silicon bring-up and debugging.

What We Need To See

Master of Science or Ph.D. in Electrical Engineering, Computer Engineering or related field with strong analog design background (or equivalent experience)
CMOS Analog / RF / mmWave / Mixed Signal Circuit Design Experience in deep sub-micron process
Experience with design and verification tools (Cadence's IC design environment, analog circuit simulation tools like Spectre, HSpice, Finesim, XA)
Experience in crafting test bench environments for component and top level circuit verification
Behavioral modeling of analog and digital circuits
Strong debugging and analytical skills
Analog simulation for noise analysis, loop stability analysis, ac/dc/tran analysis, monte-carlo, etc.
Strong interpersonal skills and ability & desire to work as a phenomenal teammate are huge plus.

NVIDIA is widely considered to be the leader of AI computing, and one of the technology world’s most desirable employers. We have some of the most forward-thinking and hardworking people in the world working for us. If you're creative and autonomous, we want to hear from you!

The base salary range is 108,000 USD - 212,750 USD. Your base salary will be determined based on your location, experience, and the pay of employees in similar positions.

You will also be eligible for equity and benefits .  NVIDIA accepts applications on an ongoing basis. 

NVIDIA is committed to fostering a diverse work environment and proud to be an equal opportunity employer. As we highly value diversity in our current and future employees, we do not discriminate (including in our hiring and promotion practices) on the basis of race, religion, color, national origin, gender, gender expression, sexual orientation, age, marital status, veteran status, disability status or any other characteristic protected by law.

JR1995620

See less"
