linkedin_url,job_title,company,location,posted_date,job_description
https://www.linkedin.com/jobs/view/4199641922/?eBP=CwEAAAGWDZa4lcviw72L5jAwAbs8jCH7n9mE_ucfrw0aA9kL1mcKqcpU5w5uLrzwthAgrTX_lgc7y3_onfHiQnQpkxvqil8Cs_zr2KRsYSDE1n26kag8SaY-WfJk3opSWzZgWe-qAMFMIGADVTH2DLjsUsS7g4jAuE8qlqpbF8Khx3JEeG86cpQC4aooA7j8JbegXaHpjLCPuniAzBBiraVn31nKtZ-assKhV1kgIS2fX2MJz11EF_fZCHiZJD8b6L804x1t9QcYG14wEUBymcuNOYVraWVxHGIaM8s3X1FhHZyrje339Sx2F90FlnNaIqkvaK9Skndl8ZPbqdWK5ldGS2-RGOZCfiqYO71_eNwS9OFQpig7QuBv7hPAlDj0Adq1r0J6gQorEJPlMSYGgC8M2pNZs1AV7P3TvJYWAnD4NZ-dKjQrFdQv1ittPwlhE3j01f-j5SexlwRQ0VzwKOghuKNOQCzcCzPk9LlClHiNZI3_C_rTOxNtuCYkF9oEGNusAR31Dg&refId=e9obDaH3D0ykCNJHBhSwcA%3D%3D&trackingId=%2FHL5MXT6oDSCjl%2B8ywjgMw%3D%3D&trk=flagship3_search_srp_jobs,Staff Robotics Mechanical Design Engineer,Atomic Machines,"Berkeley, CA",1 day ago,"About the job
Atomic Machines is ushering in a new era in micromanufacturing with its Matter Compiler (MC) technology. The MC enables new classes of micromachines to be designed and built by offering manufacturing processes and a materials library that is inaccessible to semiconductor manufacturing methods. The MC promises to unlock MEMS manufacturing both for the many device classes that never could be made by semiconductor methods but also to open up entirely new classes. Furthermore, the MC is fully digital in the way 3D printing is digital, but where 3D printing produces parts of a single material using a single process, the MC is a multi-process, multi-material technology: bits and raw materials go in and complete, functional micromachines come out. The Atomic Machines team has also created an exciting first device – one that was only made possible by the existence of the Matter Compiler – that we will be unveiling to the world soon.


Our offices are in Berkeley and Santa Clara, California

.
About the role:
We are seeking a highly skilled Robotics Mechanical Design Engineer to shape the foundation of our groundbreaking robotic manufacturing platform. In this role, you will work at the cutting edge of precision manipulation, designing critical subsystems that enable the assembly of microscopic parts with unparalleled accuracy.

This is an opportunity to work closely with cross-functional teams early in the product development cycle, collaborating with experts in mechanical design, electrical engineering, vision systems, robotics controls, and manufacturing engineering. You will be part of a fast-paced, hands-on environment, gaining deep multidisciplinary experience while directly influencing the future of scalable, high-precision automation.

If you're excited about pushing the boundaries of robotics and eager to have a high-impact role in an early-stage startup, we’d love to hear from you!

What you’ll do:
Design and develop mechanisms, end effectors, robotic axes, and systems that fit into a modular, complex robotic manufacturing platform.
Subject designs and prototypes to rigorous testing that verifies performance down to the sub-micron level at statistically significant levels.
Work cross-functionally on complex sub-systems of our automated fabrication platform to develop control algorithms, machine vision approaches, and closed-loop inspection and metrology functionalities.
Create CAD models of parts and assemblies, BOMs (bill of materials), detailed drawings, and technical design documentation.
Work collaboratively using PDM and PLM systems, project management tools, and G-Suite tools.
Get hands-on with your designs, driving your work to completion with fabrication and assembly efforts leveraging our in-house lab and machine shop.

What you’ll need:
7–10 years of relevant industry experience, including the design of electromechanical axes (bearing selection, actuator specification, and encoder selection).
Expertise in mechanical design principles, engineering fundamentals, and significant experience with CAD tools for detailed drafting and modeling.
Experience with precision engineering fundamentals.
Self-guided learner with the ability to rapidly ascend learning curves with minimal direction. While the HW Platform team includes highly experienced engineers, success in this role requires curiosity, initiative, and adaptability.
Receptive to feedback from multiple sources and able to quickly adjust approach based on input. The ideal candidate actively seeks feedback—both from colleagues and hands-on experimentation.
Team-oriented mindset with a focus on collective success. Willingness to take on varied tasks, including less glamorous but necessary work, to drive the team forward.
Maker mentality – A strong hands-on background in fabrication, machining, and prototyping is highly valued. While CAM and CNC machining proficiency are preferred, an intuitive understanding of materials and manufacturing processes is essential.
Strong written and verbal communication skills, including the ability to clearly convey complex technical ideas and document designs effectively.
Proactive and self-driven – A self-starter who takes initiative and follows through to completion.
Minimum B.S. in Mechanical Engineering (or equivalent experience).

Bonus points for:
Experience with high vacuum systems, airlocks and load locks.
Experience with laser and optical systems.
See less"
https://www.linkedin.com/jobs/view/4074773614/?eBP=CwEAAAGWDZa4lb6yNNOysBX2J_J1Dog53v0fDeSv9PtK9envex9Wf649LK28i58dAEY70QI97skCMGxcYoit2YnZB62Bl8BHSoM7Kjh_ALx_bULwKIe_mRz69QozzaQ7JXemf1FeLzHtdgbHBKGoAhqC7pTgGaQweF6-OiehtZsqgcgWg1JcTl4PdCDLpk3nDU9dKLdokN6IWRYdJhtFNRro9YixQi__AqUyqqF9zmq87VmqEWMJWD79If3yPrpEs4XILCxukZlgMlC4YsuwLW5btLp-hhcfw444oswY2htXyVhgOAyseaD4nd40kpoBMRaO8fALBjk_ZPXxazvyIOxr6ny5TYZYT-gMUGVZYPzlrOSl_44UtNiX8MLwmidxQi2wTmiRq40xF_TZvzxloafXik1mOserlDw&refId=e9obDaH3D0ykCNJHBhSwcA%3D%3D&trackingId=1xd8JoFv4OAXCNLZ9eykNw%3D%3D&trk=flagship3_search_srp_jobs,Power Design Package/Layout Design Engineer (2025 New College Graduate),GlobalFoundries,"Richardson, TX",3 months ago,"About the job
About GlobalFoundries

GlobalFoundries (GF) is a leading full-service semiconductor foundry providing a unique combination of design, development, and fabrication services to some of the world’s most inspired technology companies. With a global manufacturing footprint spanning three continents, GF makes possible the technologies and systems that transform industries and give customers the power to shape their markets. For more information, visit www.gf.com.

New College Graduates Overview

We offer many full-time employment paths for recent graduates, which provide accelerated training in a fast-paced work environment, cross-functional working opportunities, and talent mobility. New college graduates are provided with mentorship, networking, and leadership opportunities, which give our new team members life-long connections and skills.

Summary Of Role

Our team at GLOBALFOUNDRIES is seeking a Design Engineer who will be responsible for designing innovative reference circuits for power and precision analog applications using cutting-edge technologies in BCD, FinFet, FDX SOI, and GAN and associated package development. Designs will be done in technologies in early development, collaborating with the technology development team. The role also requires collaborating with strategic foundry customers through demonstrations to accelerate the adoption of GLOBALFOUNDRIES' silicon technology.

Essential Responsibilities Include

Design state-of-the art Foundry Reference Designs for applications including switching regulators (buck, boost, hybrid), precision voltage references, gate drivers, protection circuits among other building blocks for power applications.
Design or direct the packages for these applications.
Design, implement, and tape-out designs on internal test chips to showcase GLOBALFOUNDRIES power technology capabilities
Implement physical design of critical circuit elements directly or in collaboration with physical design engineers.
Perform/direct electrical verification and modifications needed to meet specifications.
Characterize silicon and/or work with test engineers to demonstrate the achievement of critical performance requirements.
Analyze characterization data, document and present results.
Work with strategic foundry customers through demonstrations to accelerate the adoption of GLOBALFOUNDRIES' silicon technology
Collaborate with innovators at research institutions and universities to push the performance envelope in related fields and future applications of the GLOBALFOUNDRIES differentiated technologies.

Other Responsibilities

Perform all activities in a safe and responsible manner and support all Environmental, Health, Safety & Security requirements and programs.

Required Qualifications

Design experience of Analog/Power circuits using BCD/FinFet/GaN IC design technologies.
Prior experience with one or more CAD tools and frameworks such as Keysight and Cadence.
Education –– Graduating with Master’s, or PhD in Electrical Engineering or related field from an accredited degree program.
Must have at least an overall 3.0 GPA and proven good academic standing.
Language Fluency - English (Written & Verbal)
Travel - Up to 10%

Preferred Qualifications

Prior related internship or co-op experience.
Demonstrated prior leadership experience in the workplace, school projects, competitions, etc.
Project management skills, i.e. the ability to innovate and execute on solutions that matter; the ability to navigate ambiguity.
Strong written and verbal communication skills
Strong planning & organizational skills
Prior experience with one or more electromigration simulation tools such as Voltus etc.
Familiarity with programing/scripting languages like Python, Perl,etc.

#NCGProgramUS

Expected Salary Range

$63,500.00 - $142,000.00

The exact Salary will be determined based on qualifications, experience and location.

If you need a reasonable accommodation for any part of the employment process, please contact us by email at usaccommodations@gf.com and let us know the nature of your request and your contact information. Requests for accommodation will be considered on a case-by-case basis. Please note that only inquiries concerning a request for reasonable accommodation will be responded to from this email address.

An offer with GlobalFoundries is conditioned upon the successful completion of pre-employment conditions, as applicable, and subject to applicable laws and regulations.

GlobalFoundries is fully committed to equal opportunity in the workplace and believes that cultural diversity within the company enhances its business potential. GlobalFoundries goal of excellence in business necessitates the attraction and retention of highly qualified people. Artificial barriers and stereotypic biases detract from this objective and may be illegally discriminatory.

All policies and processes which pertain to employees including recruitment, selection, training, utilization, promotion, compensation, benefits, extracurricular programs, and termination are created and implemented without regard to age, ethnicity, ancestry, color, marital status, medical condition, mental or physical disability, national origin, race, religion, political and/or third-party affiliation, sex, sexual orientation, gender identity or expression, veteran status, or any other characteristic or category specified by local, state or federal law
See less"
https://www.linkedin.com/jobs/view/4195358964/?eBP=CwEAAAGWDZa4lc12hkCnLMX00HLWKDIRy4OP-lyGBRFWQ8WIO4rNDWb4nJe1JEDujrduC5ASKxHw3nb4k7zmoRtddeyvRyIkkVQMIZhdM8FzZacDDMtE1WXzud27KsfWwK5tYyp84nQixSdhl7xOevr66nHTciq5ECfTmbg-Zx78ltfwJruP98p4_pxmV1xymoAbIHS-QO22mdaEbWij0LllUWw9XxKZHV6-YCLFpAp4-6SeSk8avNWdBPh1vjlfZC4LAHkoPyD0bDOmEfgmkTcPoqMhxUERZQQ44bdCbosxFE4GxshuN-IVhtzNdi3jyUD0er7FGc1aS3utDr6G2dhqaxyV9K1lvuMME28Ffq86JSYrl88IXUhSFtwlRkUNw3oVMM0673eW7E5tlhexzTVOl27ieWMUPbPk-n0BAOskOpvORH0cmffD-JjKKieZ1kP0wzUsqUdW092atO1p9Y6ZTfl8zONSzg4EgCaepaV4A2r0gAlY4NpFN182DJ9lJwI7omNpJFBb&refId=e9obDaH3D0ykCNJHBhSwcA%3D%3D&trackingId=GjoRoyM0%2B42Sw7cwpB6isw%3D%3D&trk=flagship3_search_srp_jobs,R&D Laser Design & Modeling Engineer,W3Global,N/A,N/A,"About the job
Summary

About the job

A leading supplier of high-speed transceivers used in fiber optical communications is seeking a highly motivated Semiconductor Laser Design and Modeling Engineer. Responsibilities include design, modeling, and simulations of InP and GaAs based high-speed and high-power semiconductor lasers. The candidate is responsible for creating models and software to develop next-generation optoelectronics products in a young and dynamic R&D team.

Responsibilities

Apply in-house design packages, commercial software, and self-written scripts to create high-speed or high-power laser device modeling and simulations, including optical waveguide, DC, RF, and thermal simulations.
Design process flow and photomask with device fabrication engineers.
Coordinate design verification with in-house Growth, Processing, Packaging, Characterization, and Reliability teams.
Analyze experimental results to improve the design or model.
Work as a team to propose new laser designs and provide support for design optimizations.
Provide regular written and oral reports on design tasks and progress.

Qualifications

Ph.D. degree in Electrical Engineering, Physics, Optics, or related fields; or M.S. degree with 5+ years of relevant laser design experience.
2+ years of work experience in semiconductor laser design is preferred.
Education can generally be substituted for required specialized experience.
Preferably having previous design experience in one or more of the following areas: high-speed laser, electro-absorption modulated laser (EML), vertical cavity surface-emitting laser (VCSEL), and high-power laser.
Mastery of Matlab or other programming languages.
Fully understand theories of semiconductor lasers, photodetectors, and other optoelectronic devices.
Knowledge of basic semiconductor device fabrication processes is a plus.
Self-motivated, careful, detail-oriented, and able to think logically.

Location

This position is on-site in Sugar Land, Texas.

Benefits

In addition to a competitive salary, the company offers:

Flexible and competitive health (medical, dental, vision) plans to meet individual and family needs.
Employer matching on 401(k) deferrals.
Generous PTO policy, with unused PTO payout at the end of the year.
Relocation package available within the U.S.
Immigration sponsorships (must be currently authorized to work in the U.S.).

See less"
https://www.linkedin.com/jobs/view/4202257663/?eBP=BUDGET_EXHAUSTED_JOB&refId=e9obDaH3D0ykCNJHBhSwcA%3D%3D&trackingId=idcORCREnP0AanlaPRU9xA%3D%3D&trk=flagship3_search_srp_jobs,"Internship Opportunities: Electrical, Mechanical, Artificial Intelligence, Machine Learning (AI/ML) and Industrial Engineering",Custom Manufacturing & Engineering,N/A,N/A,"About the job
This job is sourced from a job board. Learn More
Are you ready to gain valuable hands-on engineering experience this summer? Custom Manufacturing & Engineering (CME) invites enthusiastic students pursuing degrees in Electrical, Mechanical, AI/ML, or Industrial Engineering to join our team as interns!

















Interns will be compensated based on their current academic year:











Minimal & Usually Local to Vendors. 0% -5%



Custom Manufacturing & Engineering, Inc. (CME) is a 27-year-old award-winning Tampa Bay small business that designs and manufactures custom-engineered and build-to-print/spec products and systems. Our team collaborates with aerospace/defense and industrial customers to produce cables & wire harnesses, power supplies & distribution equipment, and special test equipment. CME's products are utilized by the US military and various industries worldwide.

CME operates on the EOS System, focusing on a Culture of Accountability through our 5 Core Values: Resolves Problems, Professionalism, Challenges Themselves, Delivers, and Serves Customers - Protects CME.

To learn more about our company culture, please visit: CME Careers - Culture of Accountability and click on the ""Culture of Accountability"" tab.



CME is an Equal Opportunity Employer and considers all applicants without regard to race, color, religion, sex, national origin, age, veteran status, disability, or other protected classifications.

See more"
https://www.linkedin.com/jobs/view/4200617334/?eBP=BUDGET_EXHAUSTED_JOB&refId=e9obDaH3D0ykCNJHBhSwcA%3D%3D&trackingId=sXeNpMLLwB90kXV6jDF2qA%3D%3D&trk=flagship3_search_srp_jobs,Associate Project Engineer,Pacific Gas and Electric Company,"Fresno, CA",5 hours ago,
https://www.linkedin.com/jobs/view/4189466819/?eBP=CwEAAAGWDZa4lfHq_QVFlWPvpE3FeGW5fYYotqsz6XMmkmjU4ilxlZGOuIg98HSjfjljNws5ToM3mL7xR_bu40Uf8iwhue7zgOQGVrJ_0B7ZITQR_qTLtPes-U6z7FFKvOFoNl0Jwcf7ad8b5PjWJ8Mpu12emzPEHqUGDWO5PCvcH2ziH-YSiQXDeWzabE4DfKMseWkjlxwbK-yIy3iVqpcyN9p7PyVrk5ip3KtNJuPhxnMm9i-CMCwbAmeL22Dtv3Bb8fkGlL_WEgFQG-rswhwOKAClXZWyVy4SI6mwpojWS7CcuSEUbxW0LgbsjChnTC2S0uYybmcnHhcV8T28LLt0Ll06zJCZcsbL4nABQmTRcfkd6UdYTKHrhmy5bi9nGzFs74dg7NhG9kUO8F5S7vVZri4zioyXwk3aGk4cuELQkJurTti5xyrDWDA-iw_7Jsk8RBcx4QcubYJmxw55rKcACQt0-I-8-DsKmrI3fas4wCGb5u4kr7jGxHQ9Rx-5-iBdw1a0VEQT&refId=e9obDaH3D0ykCNJHBhSwcA%3D%3D&trackingId=SP2gGJ5hugZVCEQyaxBOXA%3D%3D&trk=flagship3_search_srp_jobs,"RTL Design Engineer, Hardware Compute Group",Amazon Lab126,"Sunnyvale, CA",2 weeks ago,
https://www.linkedin.com/jobs/view/4196431645/?eBP=CwEAAAGWDZa4leY5kraGiERyaOBDpqllZ7jAUAFMHKgGpoMzUsa9IfdfpQGdP1xMwoqRzu9q0RTjHuuhbo6TG4lKJAThy08N9LTiretapRdjEbSDMkxfBZYOt1wCmWQCZ_gn1eVpGCHUCpLE3_kipe4f6qjd9hV0kGIMNwaeeH2AWacYUx3HXsDhLVo1_81BND3_FzP34DTRjNuX3nYUKdUbrNc9e1OoWPJfC2hahZGq9S0M7cfPnpFRz3q2nCUwzuai3Z0hNAly0GyYzG0kywgEUTcJ_R3R8QqF4Xo0QP8M8Jk0gMzwSd93N0I26RhEVL9WPY6Odyx0uejwDnpHdAHIwsFxQgWtWs6qvva_nz3_g-VrR-A5zSkigvXeWz0q7cmi8M0MV82FsVIWSTDqs1eXeQsN7f3-x4kg4mqPMr3cUjDReyhYg5TDPUeWz2jNFuxGvTrDKVj9Tf9Ev-0f7NGP3wWyKS75C2Okr9sEnCfH738yopFnxeWUuMFMNXa0xlO9O9d8K96y_nqctA&refId=e9obDaH3D0ykCNJHBhSwcA%3D%3D&trackingId=jzQMkZMnjFe9xpeFqb%2FyLg%3D%3D&trk=flagship3_search_srp_jobs,Semiconductor Design Engineer - TPG,Micron Technology,"Boise, ID",4 days ago,"About the job
Our vision is to transform how the world uses information to enrich life for all. 

Micron Technology is a world leader in innovating memory and storage solutions that accelerate the transformation of information into intelligence, inspiring the world to learn, communicate and advance faster than ever.

Our team vision is a continuing desire to develop your skills working in an inclusive diverse environment of multicultural Teams across worldwide geographies! Enabling the creative career path you deserve with a collaborative environment, and groundbreaking technology while rapidly growing your abilities.

This is a hybrid role in our Boise, ID office.

The seniority level offered will be based on a combination of experience and education.

Responsibilities

Design, layout, and optimization of memory circuits.

Perform circuit simulations using standard industry tools such as SPICE and VERILOG.

Assist in the design and development of schematic blocks such as memory array, control logic, address decode, datapath, and internal test logic

Understand the impact of design architecture decisions on overall power, speed, and die size.

Optimize design rules for cost, performance, and functionality

Propose improvements to CMOS devices, memory devices, and advanced circuits.

Import layout parasitic information into the circuit simulation environment

Build solutions and define requirements for circuit operation, with a focus on high volume manufacturing readiness

Develop strategies to support technology development through test chip definition and silicon validation

Look for opportunities to drive competitive advantages into our solutions by developing groundbreaking ideas and concepts

Qualifications & Skills

Ideally prior work experience with analog circuit design or debugging.

Prior experience with schematic development, circuit simulation, and layout design.

Strong understanding of the semiconductor process and semiconductor device physics.

Strong understanding of semiconductor architectures, circuits, & functions.

Strong communication skills with the ability to convey sophisticated technical concepts to peers and management.

Education

Bachelor's or Master's of Science in Electrical Engineering

(Disclaimer): While you may not exhibit all the characteristics/skills listed below today, we are highly interested in a teammate who is motivated to grow in technical breadth and depth. Suppose you are open to learning while being a valued member of a team of world-class engineers! In that case, we are determined to help build upon your existing foundation, while focusing on your individual and collaborative skills in this exciting and outstanding opportunity.

As a world leader in the semiconductor industry, Micron is dedicated to your personal wellbeing and professional growth. Micron benefits are designed to help you stay well, provide peace of mind and help you prepare for the future. We offer a choice of medical, dental and vision plans in all locations enabling team members to select the plans that best meet their family healthcare needs and budget. Micron also provides benefit programs that help protect your income if you are unable to work due to illness or injury, and paid family leave. Additionally, Micron benefits include a robust paid time-off program and paid holidays. For additional information regarding the Benefit programs available, please see the Benefits Guide posted on micron.com/careers/benefits.

Micron is proud to be an equal opportunity workplace and is an affirmative action employer. All qualified applicants will receive consideration for employment without regard to race, color, religion, sex, sexual orientation, age, national origin, citizenship status, disability, protected veteran status, gender identity or any other factor protected by applicable federal, state, or local laws.

To learn about your right to work click here.

To learn more about Micron, please visit micron.com/careers

For US Sites Only: To request assistance with the application process and/or for reasonable accommodations, please contact Micron’s People Organization at hrsupport_na@micron.com or 1-800-336-8918 (select option #3)

Micron Prohibits the use of child labor and complies with all applicable laws, rules, regulations, and other international and industry labor standards.

Micron does not charge candidates any recruitment fees or unlawfully collect any other payment from candidates as consideration for their employment with Micron.

See less"
