linkedin_url,job_title,company,location,posted_date,job_description
https://www.linkedin.com/jobs/view/4201024340/?eBP=CwEAAAGWDZa4lIJlVZ29cpS9IvyK26rRyflqkACS9pEaqXWP3R7XHOH733XKrjPY-G5cao_Nlm3S07Zisi1OoXiu4p9PddAL4YmjCbm4XW2uYGwvBZfof_QtFpMU2ldETsD8F73HO_vr59mexgqV73XhMlqAQ0DCcfrltHxH9V3T9_n4mKpb_A6RuaW1xMUmSYwbg1jQPCwyOLv9sKHSRwPU41bMzC4QtFXwexZYfLgUK8ZOAutw9fenONY1IoHlGOsykbENMgp5Mt79zfnjxpbFWiHFFUHBiC_6AKu6Wt2ztFQhYjES6AEPyzECohN6gaKVbOg-egT-2SRZczXUea7phvVcJhoFNiIv9y1cY6B6UHcdCZMhczV8ktd7O4IWePkCh_BgJKuBA4oJ85Zy5ldUgrcuzjoUKUqdEX6-G08fO5BAKu9Y4-ycgA6_GK_U5inKMt7PzKDQOagThKX_gW4QTIdAZR9mnldmjO7rKv5Ng3bTAfrvNy3eEREXQ0YVGdxs6EfXeitm&refId=e9obDaH3D0ykCNJHBhSwcA%3D%3D&trackingId=c7velWouU%2F%2FrNilnkakfYg%3D%3D&trk=flagship3_search_srp_jobs,Design Engineer – Optical Sensor System (Optics/Physics),ASML,N/A,N/A,"About the job
Introduction to the Job

ASML US, including its affiliates and subsidiaries, bring together the most creative minds in science and technology to develop lithography machines that are key to producing faster, cheaper, more energy-efficient microchips. We design, develop, integrate, market and service these advanced machines, which enable our customers - the world’s leading chipmakers - to reduce the size and increase the functionality of their microchips, which in turn leads to smaller, more powerful consumer electronics. Our headquarters are in Veldhoven, Netherlands and we have 18 office locations around the United States including main offices in Chandler, Arizona, San Jose and San Diego, California, Wilton, Connecticut, and Hillsboro, Oregon.

ASML’s Wafer Alignment Sensor department in Wilton, Connecticut is seeking a Design Engineer to support and develop complex optical/photonic sensor systems used within ASML’s photolithography tools. These systems typically include light sources, detectors, optical/electro-optical components, fiber optics, electronics and signal processing software functioning in close collaboration with the rest of the lithography system. As a design engineer, you will design, develop, build and integrate optical sensor systems.

Role and Responsibilities

General:

Use general Physics, Optics, Software knowledge and an understanding of the sensor systems and tools to develop optical alignment sensors in lithography machines
Have hands-on sills of building optical systems (e.g. imaging, testing, alignment, detector system, etc.)
Have strong data analysis sills to evaluate sensor performance and troubleshooting

Leadership:

Lead executing activities for determining problem root cause, execute complex tests, gather data and effectively communicate results on different levels of abstraction (from technical colleagues to high level managers)
Lead engineers in various competencies (e.g. software, electronics, equipment engineering, manufacturing engineering, etc.) in support of feature delivery for alignment sensors

Problem Solving:

Troubleshooting complex technical problems
Develop/debug data signal processing algorithms
Develop and execute test plans in order to determine problem root cause

Communications/Teamwork:

Draw conclusions based on the input from different stakeholders
Capability to clearly communicate the information on different level of abstraction

Programming:

Implement data analysis techniques into functioning MATLAB codes
Optimization skills
GUI building experience
Familiarly with LabView and Python
Some travel (up to 10%) to Europe, Asia and within the US can be expected

Education and Experience

To help us tackle the technical challenges we face, you will need experience working on high-tech products and with complex processes.

As an Optical Sensor System Design Engineer, you will need:

Bachelor's Degree or above in Physics, Optics, Electrical Engineering, Mechanical Engineering or related degree or equivalent experience with an emphasis on optical system performance and analysis
Knowledge on data processing and analysis and software tools (e.g MATLAB)
Hands-on experience with optical system alignment (e.g. imaging, testing, alignment, detector system, etc.)
Strong English communication skills–both written and oral
Have strong data analysis skills to evaluate sensor performance and troubleshooting
Good communication skills during brainstorm/troubleshooting sessions
Optimization skills, GUI building experience, and familiarly with LabView and Python are a plus

Skills

Working at the cutting edge of tech, you will always have new challenges and new problems to solve – and working together is the only way do that. You will not work in a silo. Instead, you will be part of a creative, dynamic work environment where you will collaborate with supportive colleagues. There is always space for creative and unique points of view. You will have the flexibility and trust to choose how best to tackle tasks and solve problems.

To thrive in this job, you will need the following skills:

Can observe and respond to people and situations and interact with others encountered in the course of work
Can learn and apply new information or skills
Must be able to read and interpret data, information and documents
Strong customer focus and commitment to customer satisfaction through prioritization, quality, efficiency and professionalism
Ability to complete assignments with attention to detail and high degree of accuracy
Proven ability to perform effectively in a demanding environment with changing workloads
Result driven-demonstrate ownership and accountability
Identifies bottlenecks and drives improvements
Work independently or as part of a team and follow through on assignments with minimal supervision
Demonstrate open, clear, concise and professional communication
Ability to establish and maintain cooperative working relationships with co-workers and customer
Work according to a strict set of procedures within the provided timelines

Other Information

This position is located on-site in Wilton, Connecticut. It requires onsite presence to attend in-person work-related events, trainings and meetings and to further ensure teamwork, collaboration and innovation
A flexible workplace arrangement may be available to employees working in roles conducive to remote work (up to 2 days a week)

This position may require access to controlled technology, as defined in the Export Administration Regulations (15 C.F.R.

730, et seq.). Qualified candidates must be legally authorized to access such controlled technology prior to beginning work. Business demands may require the Company to proceed with candidates who are immediately eligible to access controlled technology.

This position requires access to controlled technology, as defined in the United States Export Administration Regulations (15 C.F.R.

730, et seq.). Qualified candidates must be legally authorized to access such controlled technology prior to beginning work. Business demands may require ASML to proceed with candidates who are immediately eligible to access controlled technology.

Diversity and inclusion

ASML is an Equal Opportunity Employer that values and respects the importance of a diverse and inclusive workforce. It is the policy of the company to recruit, hire, train and promote persons in all job titles without regard to race, color, religion, sex, age, national origin, veteran status, disability, sexual orientation, or gender identity. We recognize that diversity and inclusion is a driving force in the success of our company.

Need to know more about applying for a job at ASML? Read our frequently asked questions.

Request an Accommodation

ASML provides reasonable accommodations to applicants for ASML employment and ASML employees with disabilities. An accommodation is a change in work rules, facilities, or conditions which enable an individual with a disability to apply for a job, perform the essential functions of a job, and/or enjoy equal access to the benefits and privileges of employment. If you are in need of an accommodation to complete an application, participate in an interview, or otherwise participate in the employee pre-selection process, please send an email to  USHR_Accommodation@asml.com to initiate the company’s reasonable accommodation process.

Please note: This email address is solely intended to provide a method for applicants to initiate ASML’s process to request accommodation(s). Any recruitment questions should be directed to the designated Talent Acquisition member for the position.
See less"
https://www.linkedin.com/jobs/view/3909726863/?eBP=BUDGET_EXHAUSTED_JOB&refId=e9obDaH3D0ykCNJHBhSwcA%3D%3D&trackingId=duEaxyIf6Y9movlJ7czdMg%3D%3D&trk=flagship3_search_srp_jobs,Design Engineer,Latent,N/A,N/A,"About the job
We are looking to hire our design engineer! In this role, you will work closely with the co-founders and our early customers to help health systems operate more efficiently and deliver better patient care.

Responsibilities

Collaborate with co-founders to design product features that delight early customers
Work closely with early customers to understand business requirements and design features that really matter
Help grow the organization and set cultural direction
See less"
https://www.linkedin.com/jobs/view/4202752589/?eBP=CwEAAAGWDZa4lYvuicuqug8AYCtHCllApmlqntrTuRKy-ZfOrGVz3rAEKHlcvA5rhKwCueFqCLUqD4NnOIx52j0bbzWbgucpMdPDVXXr8uV5WvLBpuJTsjpqo4M8Jav_bJJDt2ytjAfbnUjFnqh7A5rbElLmWC6RwGrFBTeBp1QCay0233-n2DXdr3gtcqu3_XAMqPH84kSG6DJsQk1S3RUbXPyjwp92ekykPB2wwwC_oU2JuIRNhLN57lkhUPr7biEKebSxZjrdPGNB5CsrjuJziSVtyBR72m63xxEWk2rNqJr1gbGdB9wwxM9M2Fg8OPkIUf514CDWOp2TvETGCROTBfpGcwp7rfJEZvKkgpxKGZ5ahob78UnOrAkF8EGPTaDgfBmxqV_tXq-7q9ER1nFvoLA-HocGab8YqympOQklT97a9ewK44NcZ8WDgnNiC5nNUJO1H8sX6XZL2JUkRKmhJrGkNFr7ZrXAUxFlq22EIRR1mXRAeuSZeBoPr5fD6Q&refId=e9obDaH3D0ykCNJHBhSwcA%3D%3D&trackingId=nFLEAAPa7v7WRX4%2B4pdRIQ%3D%3D&trk=flagship3_search_srp_jobs,Mechanical Engineering Intern,GaeaStar,"San Francisco, CA",8 hours ago,"About the job
🌎 Earth back to earth. GaeaStar combines traditional craftsmanship with additive manufacturing techniques, creating technology for a world where convenience does not destroy our planet.

Every year, over 500 billion single-use cups are used worldwide. Less than 1 % are ever recycled. Our motivation is simple: We believe we have a responsibility to eliminate the negative impact of single-use products. GaeaStar develops distributive manufacturing technology for to-go ceramics –– thin clay vessels made from simple, abundant materials with zero plastics. At scale, close to the point of use.


Your Role

This ad goes out to makers, who want to contribute to a meaningful mission affecting all of us, those who want to learn and grow by solving difficult challenges.

We currently offer a 3-6 month internship in our engineering team at GaeaStar. You'll work directly with our principal engineer and support the further build out and scale of our San Francisco production facility. As a member of the team, you'll work on process optimization and equipment revisions to automate production steps and greatly increase production capacity.

Collaboration among cross-functional teams. You collaborate with and support a small team of mechanical engineers and ceramicists, directly engaging with stakeholders from operations, production, and product.
Technical support along the manufacturing process. Get to know the production process and equipment inside and out. You'll help troubleshoot production issues, identifying bottlenecks as we grow output.
Work on impactful projects. Specific projects that may be tackled during your internship include a revision of our rim touch up and glazing process, revisions to our robotic machine tending assembly, and the optimization of our packaging solution.
Prototype and iterate quickly. You come up with ideas, quickly prototype a solution and iterate from there.
Grow GaeaStar with us. We’ll challenge you to take on altogether new responsibilities at times. Rapidly learn and iterate with us. We’re a small company with huge ambitions.


Your Profile
Engineering. Completed two years of university-level courses, and currently enrolled in a Bachelor's or Master's program. Relevant programs include Manufacturing Engineering, Mechanical Engineering, Mechatronics, Industrial Engineering, and related fields.
Demonstrated interest in manufacturing at scale. Think short cycle times at high volumes. Our main focus at the moment is quickly increasing production capacity while keeping unit costs constrained.
Passion for industrial automation. A lot of great solutions already exist. Projects that would have had you interface with vendors on automation challenges or working on automation in growing production environments are a big plus.
Maker profile. You have a high level of craftsmanship married with the ability to get things done. You’re pragmatic, enjoy fixing things, and you don’t mind rolling up your sleeves to get things up and running.
Solid CAD skills. We’re using OnShape, but any CAD software will do.
Location. GaeaStar is an in-person company, because we believe teams that are together move faster. To apply, you should be authorized to work in the US and live within commuting distance or relocate to San Francisco.

We are one team. We celebrate our diversity and believe in equal opportunities regardless of race, gender, citizenship, age, religious beliefs, physical ability, marital status, or sexual orientation. And we expect the same from you!

Why GaeaStar?

3-6 Month full-time internship. Time to truly immerse yourself in a fast-moving startup and learn from experienced engineers.
Meaningful mission. We are a small engineering company with big ambitions, making a difference one cup at a time.
A great challenge. What we are doing here is not easy! We learn together and support each other.
No red tape. We are an early stage startup focused on getting things done. You will find lots of room to innovate and move quickly.
See less"
https://www.linkedin.com/jobs/view/4102615749/?eBP=CwEAAAGWDZa4lY65RhXRevspV1TQmOlNxdQefZnw0uI83rUA3uT45MsBZsSWitNQygOc2Zf1HOBvDsh2klD5idjAEsW3E1zp1pf_W1_LG21zEX0s7MHUMFp0VbR-Pi58M54_8vvAsHr5H6fstYB8rlVS2pmi5q3-eNIFqk029SeocEgvaI_qsRdb1fJHLZ8O47hpe48NuI7kQPtUPHxaAutzhxLUHp-wTFi0YbfwjZOLjnTYVezqWgXRiiwMHe5kpHJrqfK3z82zQhu8CVACJPNqGfR5zBU5_Vy7NlGLBKAo7AXVNyGWxm-0O972QNEx_VLuQxzKr1l87tpdtqY0jv6gVkwNKyt4IKz7Q8huuRGOaL1X3ZPmzVw_C_XjOthywoPnTwkigamjYZHZzjxHWmOfAdf1evJgWQddg8WaKftQ7zu1grAleknuQ8ZeRcCs532tyai13Rhqo_nB4JWNHrv-vt2Z2JzCaxRQ_wWcOoxFK1lTxhh3WiEzwTDOk6QCgTOwQhl_Pp4_&refId=e9obDaH3D0ykCNJHBhSwcA%3D%3D&trackingId=kai1QhWs4VrT08T5QTWUDw%3D%3D&trk=flagship3_search_srp_jobs,Digital Design Engineer,Broadcom,N/A,N/A,"About the job
Job Description:

Broadcom ASIC product division is a leader in semiconductor innovation, delivering cutting-edge custom silicon solutions for AI, networking, HPC among many other applications. We are seeking a staff Digital Front-End Designer with deep expertise in RTL design, synthesis, and design optimization to drive the development of high-performance digital systems for our next-generation products.

As a Staff Digital Front-End Designer, you will own the design and implementation of complex digital IP and subsystems, focusing on RTL coding, micro-architecture, and design trade-offs. You will collaborate closely with verification engineers and physical design teams to ensure functional correctness, timing closure, and overall design robustness, with a strong focus on critical handling of clock and reset domains crossings.

Key Responsibilities:

Technical Leadership and Domain Expertise:


Lead the design and implementation of advanced digital blocks and subsystems.
Provide domain expertise in RTL coding, micro-architecture, and PPA trade-offs to optimize performance, power, and area.


RTL Design and Micro-Architecture:


Develop high-quality RTL designs using Verilog/SystemVerilog, adhering to best practices and coding standards.
Define and refine micro-architecture specifications, focusing on efficient and robust design implementations.


Synthesis and Timing Closure:


Perform synthesis and work with physical design teams to achieve timing closure and optimize multi-clock designs.
Debug and resolve timing, power, and area issues using tools such as Synopsys Design Compiler and Cadence Genus.


CDC/RDC and Design Quality Assurance:


Analyze CDC/RDC reports using industry-standard tools (e.g., Spyglass, Questa CDC) to identify and resolve potential issues.
Apply best practices to ensure robust clock and reset domain crossings while minimizing design risk and complexity.


Verification Collaboration and Formal Methods:


Collaborate with verification engineers to define test plans, ensure functional coverage, and develop testbench requirements.
Utilize formal verification tools (e.g., JasperGold, Formality) and static checks to ensure design correctness and robustness.


Optimization and Innovation:


Continuously explore innovative approaches to optimize designs for PPA, balancing design requirements with project goals.
Drive iterative improvements based on verification outcomes and analysis feedback.


Documentation and Design Reviews:


Create and maintain comprehensive design documentation, including micro-architecture specifications, CDC/RDC strategies, and verification plans.
Participate in cross-functional design reviews to ensure adherence to project goals and high design quality.


Qualifications:


Experience:
Bachelor’s degree in Electrical Engineering, Computer Engineering, or a related field and 12+ years of experience in digital front-end design, with a focus on complex IP or SoC design or Master’s degree in Electrical Engineering, Computer Engineering, or a related field and 10+ years of experience in digital front-end design, with a focus on complex IP or SoC design.
Technical Expertise:
Strong proficiency in RTL design using Verilog/SystemVerilog.
Expertise in micro-architecture design and PPA trade-offs.
Experience in synthesis, STA, and timing closure using tools like Synopsys DC or Cadence Genus.
Working knowledge of CDC/RDC analysis and debugging using tools such as Spyglass, Questa CDC, or similar.
Knowledge Areas:
Solid understanding of digital design fundamentals such as pipelining, FSMs, clock domains, and data paths.
Familiarity with bus protocols (e.g., AXI, AHB) and memory interfaces.
Understanding of low-power design techniques and DFT methodologies is a plus.
Soft Skills:
Strong analytical and problem-solving skills with meticulous attention to detail.
Effective communication and collaboration skills to work seamlessly across teams.
Ability to manage complex tasks and meet deadlines in a dynamic environment.


Preferred Qualifications:


Experience with scripting languages (e.g., Python, Perl, TCL) for automation and design tool integration.
Familiarity with physical design flows and collaboration with back-end design teams.
Proven track record of successfully handling complex CDC/RDC scenarios in large designs.


Additional Job Description:

Compensation And Benefits

The annual base salary range for this position is $141,000 - $225,000.

This position is also eligible for a discretionary annual bonus in accordance with relevant plan documents, and equity in accordance with equity plan documents and equity award agreements.

Broadcom offers a competitive and comprehensive benefits package: Medical, dental and vision plans, 401(K) participation including company matching, Employee Stock Purchase Program (ESPP), Employee Assistance Program (EAP), company paid holidays, paid sick leave and vacation time. The company follows all applicable laws for Paid Family Leave and other leaves of absence.

See less"
