linkedin_url,job_title,company,location,posted_date,job_description
https://www.linkedin.com/jobs/view/4186474585/?eBP=CwEAAAGWDZa4lHrJhxZsYg9_Q-7rons0-P288h62MOKnuZ-s11EysTlquifThNcSdi_wYQ0S3qvMLpmO9TDBcpD1ThbKiHUUbu2tyIxohiQWiqsTZ_tg03Zm0mNqsLzeD6qwiZ-8Q2rnWXAx7rCdIryDAlA9TptDKER4sHVBnZYpk9KyG0TftsfA8EvhSQEuESpbPSJ75B-cqbLCA4oIVxxPqp2M53PLuHzivQaQh2NMVzKQQtRT2bhIgXlXtznmol4caOLJ54IXPQr_eaQOGnBbPGliajnA7nZdCew8rux62FrdgJDz0s3IUa4rnXsQeVRC-ckodaQy4e_zeXUfuKQlwmdESCQ7F6xyKvyO9i6L7WizxbW3ONr25GaOAM8HTPLMpuyBwHgd7vLOOZ5WjeSvFeUGukWg9mujDcIaAYKPhBAzlthxW9GMPrpwNyLLWPIcSl1Ia234X1reEwlNB2ge6HoCdzesqDMoW59_SwE2f0yDuna9cVSs_Y3RaXXkKs86ripBpA81YjQ&refId=e9obDaH3D0ykCNJHBhSwcA%3D%3D&trackingId=Gf%2BIK%2FCGTMdNt%2BR1PxtAyw%3D%3D&trk=flagship3_search_srp_jobs,"Intern, Logic Design Engineer",Samsung Semiconductor,"San Jose, CA",2 weeks ago,"About the job
Please Note

To provide the best candidate experience amidst our high application volumes, each candidate is limited to 10 applications across all open jobs within a 6-month period.

Advancing the World’s Technology Together

Our technology solutions power the tools you use every day--including smartphones, electric vehicles, hyperscale data centers, IoT devices, and so much more. Here, you’ll have an opportunity to be part of a global leader whose innovative designs are pushing the boundaries of what’s possible and powering the future.

We believe innovation and growth are driven by an inclusive culture and a diverse workforce. We’re dedicated to empowering people to be their true selves. Together, we’re building a better tomorrow for our employees, customers, partners, and communities.

What You’ll Learn 

Project Overview: Design & Implement Flow control block in a NPU
Skills You’ll Learn:
Defining micro-architecture with given high level architectures
Implementation using Verilog
Logic verification using simulation tools 
What You’ll Do

This intern will be working in the Advanced Controller Development lab, one of our Memory labs. They will be focused on micro architecture of a flow control block between DMA and Tensor blocks. They will also be expected to implement the logic and verify through simulation tools, as well as write micro-architecture specification, verification plan, and verification reports.

Location: Working onsite at our San Jose, CA headquarters 5 days per week.

Reports to: Sr. Director

Participate in the definition of micro architecture in house NPU.
Collaborate with other architects under the supervision of a mentor.
Implement given logic block and verify it.
Generate project reports.
Complete other responsibilities as assigned.

What You Bring

Pursuing Bachelors, Masters, or PhD in Electrical or Computer Engineering
Must have at least 1 academic quarter/semester remaining
RTL language experience like Verilog, VHDL
C++/C programing experience
Logic design knowledge and/or experience
You’re inclusive, adapting your style to the situation and diverse global norms of our people.
An avid learner, you approach challenges with curiosity and resilience, seeking data to help build understanding.
You’re collaborative, building relationships, humbly offering support and openly welcoming approaches.
Innovative and creative, you proactively explore new ideas and adapt quickly to change.

What We Offer

The pay range below is for all roles at this level across all US locations and functions. Individual pay rates depend on a number of factors—including the role’s function and location, as well as the individual’s knowledge, skills, experience, education, and training.

This is in addition to our diverse package of benefits centered around the wellbeing of our employees and their loved ones. In addition to the usual Medical/Dental/Vision, our inclusive rewards plan empowers our people to care for their whole selves. An investment in your future is an investment in ours.

Relocation Support Live 50+ miles away from your new office? No worries! We'll provide a stipend to help support your move.

Housing Stipend Signing a lease on a new place for your summer internship? We'll help you pay your way with a monthly stipend.

Give Back With a charitable giving match and frequent opportunities to get involved, we take an active role in supporting the community.

Prioritize Emotional Wellness With on-demand apps and paid therapy sessions, you’ll have support no matter where you are.

Stay Fit Eating well and being active are important parts of a healthy life. Our onsite Café and gym, plus virtual classes, make it easier.

Embrace Flexibility Benefits are best when you have the space to use them. That’s why we facilitate a flexible environment so you can find the right balance for you.

Hourly Base Pay Rate

$28—$62 USD

Equal Opportunity Employment Policy 

Samsung Semiconductor takes pride in being an equal opportunity workplace dedicated to fostering an environment where all individuals feel valued and empowered to excel, regardless of race, religion, color, age, disability, sex, gender identity, sexual orientation, ancestry, genetic information, marital status, national origin, political affiliation, or veteran status.

When selecting team members, we prioritize talent and qualities such as humility, kindness, and dedication. We extend comprehensive accommodations throughout our recruiting processes for candidates with disabilities, long-term conditions, neurodivergent individuals, or those requiring pregnancy-related support. All candidates scheduled for an interview will receive guidance on requesting accommodations.

Recruiting Agency Policy

We do not accept unsolicited resumes. Only authorized recruitment agencies that have a current and valid agreement with Samsung Semiconductor, Inc. are permitted to submit resumes for any job openings.

Covid-19 Policy

To help keep our employees, customers, and communities safe, we've developed guidelines for our team. Currently, we encourage vaccination for all employees and may require it depending on job functions (e.g., traveling for business, meeting with customers). While visiting our offices or attending team events, we ask employees to complete a daily health questionnaire and complete a weekly COVID test. Our COVID policies are subject to change depending on public health, regulatory, and business circumstances.

Applicant Privacy Policy

https://semiconductor.samsung.com/us/careers/privacy
See less"
https://www.linkedin.com/jobs/view/4174508889/?eBP=CwEAAAGWDZa4lPnmPv01hIATYDVcsppIMTj2se0q6RnXl7svhnnZXDmMYqQr8Ka_fzQ9TuXKF6j1TYLIFalysCjXfu_fCKwosDSabXn0P7Ws5bq98CLUI0EjaiSGfXKXRbLyM8ytqjFCx2RIHeb2HV8jj-Ue07dQfhMNbyVA2-IsnQd2H7LMSBJhrBwDKY1IebT789E-KHMxdAk6HXhUPxFD8aCH_QfhinqQ6Mo9SvtVeVKLNk6cI2FJ3GlK2e3ZQtq-T2fzGjbwu7ufMYvff7mOQL47oDhNJi04maN5ZdLeag9Pfubt-1cqgtVMQ_QVFyhxKT8_9V4s7l-QWQmwV2xR5j67p_wNgybotVZy-Og3AB8bIRZHPYNf40rCjjt0Add7JFkpjdmbiLPybRlt6TOSJ92VeW1dEtj22NUhlxl3d7GVtmZNMmb4Hdf9MLmvx9_fbCLJYQn5wggMzd3e6Jy7YxNb9gDhuXpf4CE6rHCa6hpPQsWdbO9EutCC0PAtAuWwCHy9xeyn&refId=e9obDaH3D0ykCNJHBhSwcA%3D%3D&trackingId=5Nd97Psr1FrFHEyqpkHHQA%3D%3D&trk=flagship3_search_srp_jobs,Graduate - Logic Design Engineer,Infineon Technologies,N/A,N/A,"About the job
This opening is part of Infineon’s Graduate program. The Graduate Program gives you the opportunity to gain enriching and diverse experiences and work side by side with experienced leaders to power your career.

In your new role you will:

Assist the team with the setup and running of front-end design tools
Support the team in various front-end design tasks, including synthesis and simulation
Gradually take ownership of Lint, Clock Domain Crossing (CDC), and Multi-Voltage Rule Checking (MVRC) processes
Collaborate with senior engineers on the development and verification of digital design components
Participate in design reviews and contribute to the improvement of design methodologies
Document design processes and findings accurately and clearly

You are best equipped for this task if you are/have:

Graduating Spring 2025 with a B.S or M.S in Electrical Engineering, Computer Science, or a related field
Strong analytical and problem-solving skills
Good verbal and written communication skills
Basic understanding of digital logic design principles
Experience with hardware description languages such as VHDL or Verilog
Basic knowledge of EDA tools and design flows
Understanding of digital design verification techniques
Ability to work effectively in a team environment and manage multiple tasks

Infineon Power & Sensor Systems (PSS) semiconductors play a vital role in enabling intelligent power management, smart sensitivity as well as fast and reliable data processing in an increasingly digitalized world.

Our leading-edge power devices make chargers, adapters, power tools and lighting systems smarter, smaller, lighter and more energy-efficient. Our trusted sensors increase the context sensitivity of “things” and systems such as HMI, and our RF chips power fast and reliable data communication.

– We drive leading-edge power management, sensing and data transfer capabilities –

Click here for more information about working at PSS with interesting employee and management insights and an overview with more #PSSDreamJobs

#WeAreIn for driving decarbonization and digitalization.

As a global leader in semiconductor solutions in power systems and IoT, Infineon enables game-changing solutions for green and efficient energy, clean and safe mobility, as well as smart and secure IoT. Together, we drive innovation and customer success, while caring for our people and empowering them to reach ambitious goals. Be a part of making life easier, safer and greener.

Are you in?

We are on a journey to create the best Infineon for everyone.

This means we embrace diversity and inclusion and welcome everyone for who they are. At Infineon, we offer a working environment characterized by trust, openness, respect and tolerance and are committed to give all applicants and employees equal opportunities. We base our recruiting decisions on the applicant´s experience and skills.

We look forward to receiving your resume, even if you do not entirely meet all the requirements of the job posting.

Please let your recruiter know if they need to pay special attention to something in order to enable your participation in the interview process.

Click here for more information about Diversity & Inclusion at Infineon.

Driving decarbonization and digitalization. Together.

Cypress Semiconductor Corporation, is an equal opportunity employer. All qualified applicants will receive consideration for employment without regard to race, color, religion, sex (including pregnancy, childbirth, or related medical conditions), gender identity, national origin, ancestry, citizenship, age, physical or mental disability, legally protected medical condition, family care status, military or veteran status, marital status, domestic partner status, sexual orientation, or any other basis protected by local, state, or federal laws.

Employment at Infineon is contingent upon proof of your legal right to work in the United States under applicable law, verification of satisfactory references and successful completion of a background check and drug test, and signing all your on-boarding documents.

In some instances, if applicable, U.S. export control laws require that Infineon obtain a U.S. government export license prior to releasing technologies to certain persons. This offer is contingent upon Infineon's ability to satisfy these export control laws as related to your employment and anticipated job activities. The decision whether or not to submit and/or pursue an export license to satisfy this contingency, if applicable, shall be at Infineon's sole discretion.

Infineon Technologies takes data privacy and identity theft very seriously. As such, we do not request personally-identifiable information (PII) from applicants over the internet or electronically. Please kindly refrain from disclosing your PII electronically during the application process or to unauthorized websites that may purport to be Infineon or any of our affiliates.

Wage range that the company expects to pay for a qualified candidate:

Minimum of $75,000.00 salary per year

Maximum of $90,00.00 salary per year

In addition, all employees will be eligible to participate in an incentive plan.



See less"
https://www.linkedin.com/jobs/view/4130149818/?eBP=CwEAAAGWDZa4lARMbbQDjSAlrfOdNC5RzQWJkDBu5tEBOO8s_Kqdv7K8n4p8DtXE3C5qrHwkb2AxvLVUX28QyPQ1ch_cjAgc3X7yNHJfAAqBXexcJnQxOLXxqf_FWBsPbTfy9F-RFOyqV6l_q7XlykXwrjSjMmpLmfIFzRGDAuI7Ub27EjShB9GRX1FxMKPkeeSTvqZ_P-zwvXvZE-9d3YmIvV8oeOKizUNbdK7ElWTq7XX6UdkUMsKrXdXLFI6EiD8wx8DCLelUmmjJYciXnJe74eEEFoZKxe81vP0KtwctJB4XrQtB6083Ezu3uOTPw3-kwRYuy7k3b6pt36aL94Qox96Kr-Xekk_fwYi7aqZUH0o8nMdOmCuMJ9Oh8chTwc0SPAVh9XDU0rrKmMMtP0jPieUEHR7E86A2C9i0Xt6U8pCp6JciCOuiPSuFhu-reCA3fK-2R4Uff4BBpCNxtHoApqUnJUKwP7A-OhU8U9wkOSHE1W6E4FFCktJ4jBMWhqozjH2zcGPf&refId=e9obDaH3D0ykCNJHBhSwcA%3D%3D&trackingId=RkKPCBS5StxDUPFEe%2FLWvQ%3D%3D&trk=flagship3_search_srp_jobs,Career Accelerator Program - Digital Design Engineer - Bachelors,Texas Instruments,"Dallas, TX",5 days ago,"About the job
Job Description

Change the world. Love your job. 

In your first year with TI, you will participate in the Career Accelerator Program (CAP), which provides professional and technical training and resources to accelerate your ramp into TI and set you up for long-term career success. Within this program, we also offer function-specific technical training and on-the-job learning opportunities that will encourage you to solve problems through a variety of hands-on, meaningful experiences from your very first day on the job.

As a Digital IC Design Engineer, you'll architect new TI products and make our customers' visions a reality. You'll define, design, model and verify digital circuits, which fully meet the performance, power, cost and schedule requirements. You'll define, design, model, implement and document the world first 64-bit DSP processor, MMU and heterogeneous multicore shared memory and cache systems including coherent TI DSP and ARM processors. You'll have the opportunity to work in exciting areas such as CPU simulator development, 64-bit vector processor ISA architecture, development and verification etc.

As a Digital IC Design Engineer, some of your responsibilities may include:

Partner with business teams and system engineering to develop mutually agreeable design specifications
Provide high-level analysis on chip architecture trade-offs to ensure spec compliance and superior performance at a competitive cost
Participate in design reviews and creating the necessary design and product documentation
Supervise IC layouts to ensure a high-performance standard
Characterize prototypes, developing test specifications and coordinating with test/product engineering to drive product releases
Drive behavioral models

As part of your job, you will also get exposure to other roles such as: Design Verification& Analog Design through formal learning, projects and on-the-job development experiences that will help you broaden your knowledge and accelerate your growth and success at TI.

Put your talent to work with us as a Digital Design Engineer!

Texas Instruments will not sponsor job applicants for visas or work authorization for this position.

Qualifications

Minimum requirements:

Bachelors degree in Electrical Engineering, Electronics Technology, Electrical Engineering Technology, Electrical and Computer Engineering or related field
Cumulative 3.0/4.0 GPA or higher

Preferred Qualifications

Ability to establish strong relationships with key stakeholders critical to success, both internally and externally
Strong verbal and written communication skills
Ability to quickly ramp on new systems and processes
Demonstrated strong interpersonal, analytical and problem-solving skills
Ability to work in teams and collaborate effectively with people in different functions
Ability to take the initiative and drive for results
Strong time management skills that enable on-time project delivery

About Us

Why TI?

Engineer your future. We empower our employees to truly own their career and development. Come collaborate with some of the smartest people in the world to shape the future of electronics.
We're different by design. Diverse backgrounds and perspectives are what push innovation forward and what make TI stronger. We value each and every voice, and look forward to hearing yours. Meet the people of TI 
Benefits that benefit you. We offer competitive pay and benefits designed to help you and your family live your best life. Your well-being is important to us.

About Texas Instruments

Texas Instruments Incorporated (Nasdaq: TXN) is a global semiconductor company that designs, manufactures and sells analog and embedded processing chips for markets such as industrial, automotive, personal electronics, communications equipment and enterprise systems. At our core, we have a passion to create a better world by making electronics more affordable through semiconductors. This passion is alive today as each generation of innovation builds upon the last to make our technology more reliable, more affordable and lower power, making it possible for semiconductors to go into electronics everywhere. Learn more at TI.com .

Texas Instruments is an equal opportunity employer and supports a diverse, inclusive work environment. All qualified applicants will receive consideration for employment without regard to race, color, religion, creed, disability, genetic information, national origin, gender, gender identity and expression, age, sexual orientation, marital status, veteran status, or any other characteristic protected by federal, state, or local laws.

If you are interested in this position, please apply to this requisition.

About The Team

TI does not make recruiting or hiring decisions based on citizenship, immigration status or national origin. However, if TI determines that information access or export control restrictions based upon applicable laws and regulations would prohibit you from working in this position without first obtaining an export license, TI expressly reserves the right not to seek such a license for you and either offer you a different position that does not require an export license or decline to move forward with your employment.
See less"
https://www.linkedin.com/jobs/view/4175204697/?eBP=CwEAAAGWDZa4lL3ceLX9q3AhiHtbqu1XHGnepdTD_VaEo9unRfQ5zw8TErVfJnOYB9lzAFKuakwHGRTtSA8JH68Bjj9Dk4ZRzvq4lLUCynqs_P5Qkjo98hsD97WgOtTgvm1SMZ3xFEpPVRsaalcX-gA3nq9tdZFUqG3XCCCj5B7Du6luF7-mpP78V8rY_VdQULu7DdiWKKT-LpvXNLarq2KSQSwKWW1gG3T-vBz-KagrDZ-D08LQjt3MpTBXiE-MaHnAnbK3KZGrqRpHQY27AoTOQWIVR8MzLy4oF0Tl8OGCea_B_GdnBDS6wNz-uKM6dSfm0sXqHqXXkD4_kkCQT3vpoqo-Cv38xqggGJw64SyUEr4AvILYXiSbFZKC_aO7Dht8_eaOeCxYnGC2rtjscYx68Lfek6eRmeuTKLkHANCux08hjV49BZZCa1GcjYaaIexVJEWHT2af2AXqFyCD8I5NqQA9ss1rYoaUEyrKj82O-ARwVCHixvbqeTLl32exSlB7xF1TU9yP&refId=e9obDaH3D0ykCNJHBhSwcA%3D%3D&trackingId=8rCGudGRYtnjPIv14Hm0vQ%3D%3D&trk=flagship3_search_srp_jobs,"Hardware Design Engineer, Board and Systems, Platforms",Google,"Sunnyvale, CA",1 week ago,"About the job
Minimum qualifications:

Bachelor’s degree in Electrical Engineering, Computer Engineering, Physics, a related field, or equivalent practical experience.
2 years of experience working in enterprise hardware systems design, or 1 year of experience with an advanced degree.








Our Platforms Infrastructure Engineering team designs and builds the hardware and software technologies that power all of Google's services. Our computational tests are complex and unique, enabled by cutting-edge custom hardware designed and made in-house. As a Hardware Engineer, you will design and build the systems that are the heart of the world's biggest computing infrastructure. You will see those systems from concept all the way through to high volume manufacturing. Your work has the potential to shape the machinery that goes into our cutting-edge data centers affecting millions of Google users.

The ML, Systems & Cloud AI (MSCA) organization at Google designs, implements, and manages the hardware, software, machine learning, and systems infrastructure for all Google services (Search, YouTube, etc.) and Google Cloud. Our end users are Googlers, Cloud customers and the billions of people who use Google services around the world.

We prioritize security, efficiency, and reliability across everything we do - from developing our latest TPUs to running a global network, while driving towards shaping the future of hyperscale computing. Our global impact spans software and hardware, including Google Cloud’s Vertex AI, the leading AI platform for bringing Gemini models to enterprise customers.

The US base salary range for this full-time position is $126,000-$181,000 + bonus + equity + benefits. Our salary ranges are determined by role, level, and location. Within the range, individual pay is determined by work location and additional factors, including job-related skills, experience, and relevant education or training. Your recruiter can share more about the specific salary range for your preferred location during the hiring process.

Please note that the compensation details listed in US role postings reflect the base salary only, and do not include bonus, equity, or benefits. Learn more about benefits at Google .






Google is proud to be an equal opportunity workplace and is an affirmative action employer. We are committed to equal employment opportunity regardless of race, color, ancestry, religion, sex, national origin, sexual orientation, age, citizenship, marital status, disability, gender identity or Veteran status. We also consider qualified applicants regardless of criminal histories, consistent with legal requirements. See also Google's EEO Policy and EEO is the Law. If you have a disability or special need that requires accommodation, please let us know by completing our Accommodations for Applicants form .
See more"
